tweet_number,created_at,timestamp,text
473,4/25/2017 17:51:03,4/25/2017 13:51:03,"Remarks at the United States Holocaust Memorial Museum's National Days of Remembrance. 
Full remarks:… https://t.co/BJbI6ZtGo7"
474,4/25/2017 23:32:13,4/25/2017 19:32:13,"Presidential Executive Order on Promoting Agriculture and Rural Prosperity in America'
Executive Order:… https://t.co/LVMjZ9Ax0U"
475,4/26/2017 10:20:00,4/26/2017 6:20:00,First the Ninth Circuit rules against the ban &amp; now it hits again on sanctuary cities-both ridiculous rulings. See you in the Supreme Court!
476,4/26/2017 10:30:54,4/26/2017 6:30:54,"Out of our very big country, with many choices, does everyone notice that both the ""ban"" case and now the ""sanctuary"" case is brought in ..."
477,4/26/2017 10:38:51,4/26/2017 6:38:51,"...the Ninth Circuit, which has a terrible record of being overturned (close to 80%). They used to call this ""judge shopping!"" Messy system."
478,4/26/2017 10:51:06,4/26/2017 6:51:06,The U.S. recorded its slowest economic growth in five years (2016). GDP up only 1.6%. Trade deficits hurt the economy very badly.
479,4/26/2017 14:53:26,4/26/2017 10:53:26,"HAPPY BIRTHDAY to our @FLOTUS, Melania! 
https://t.co/rYYp51mxDQ https://t.co/np7KYHglSv"
480,4/26/2017 18:10:04,4/26/2017 14:10:04,"Today, I signed an Executive Order @ the U.S. Dept. of @Interior: 'Review of Designations Under the Antiquities Act… https://t.co/Eq6JDzMqTY"
481,4/26/2017 20:49:16,4/26/2017 16:49:16,"Today, I signed an Executive Order on Enforcing Statutory Prohibitions on Federal Control of Education. EO:… https://t.co/YYafFQncbC"
482,4/26/2017 22:27:29,4/26/2017 18:27:29,"A great great honor to welcome &amp; recognize the National Teacher of the Year, as well as the Teacher of the Year fro… https://t.co/pUGl7RDoVX"
483,4/26/2017 23:06:16,4/26/2017 19:06:16,"Democrats are trying to bail out insurance companies from disastrous #ObamaCare, and Puerto Rico with your tax dollars. Sad!"
484,4/27/2017 11:12:12,4/27/2017 7:12:12,I received calls from the President of Mexico and the Prime Minister of Canada asking to renegotiate NAFTA rather than terminate. I agreed..
485,4/27/2017 11:21:20,4/27/2017 7:21:20,"...subject to the fact that if we do not reach a fair deal for all, we will then terminate NAFTA. Relationships are good-deal very possible!"
486,4/27/2017 11:30:20,4/27/2017 7:30:20,The Democrats want to shut government if we don't bail out Puerto Rico and give billions to their insurance companies for OCare failure. NO!
487,4/27/2017 14:37:09,4/27/2017 10:37:09,I want to help our miners while the Democrats are blocking their healthcare.
488,4/27/2017 14:37:30,4/27/2017 10:37:30,I promise to rebuild our military and secure our border. Democrats want to shut down the government. Politics!
489,4/27/2017 14:37:51,4/27/2017 10:37:51,What's more important? Rebuilding our military - or bailing out insurance companies? Ask the Democrats.
490,4/27/2017 14:38:14,4/27/2017 10:38:14,Democrats jeopardizing the safety of our troops to bail out their donors from insurance companies. It is time to put #AmericaFirst🇺🇸
491,4/27/2017 14:39:04,4/27/2017 10:39:04,Democrats used to support border security — now they want illegals to pour through our borders.
492,4/27/2017 14:39:25,4/27/2017 10:39:25,As families prepare for summer vacations in our National Parks - Democrats threaten to close them and shut down the government. Terrible!
493,4/27/2017 18:59:31,4/27/2017 14:59:31,.@FLOTUS Melania and I were honored to welcome Argentina President @MauricioMacri and First Lady Juliana Awada to t… https://t.co/gR3EPznu1H
494,4/27/2017 21:42:47,4/27/2017 17:42:47,"Presidential Memorandum for the @CommerceGov, @SecretaryRoss re: Aluminum Imports and Threats to National Security:… https://t.co/GnKoVz9GTO"
495,4/27/2017 22:43:19,4/27/2017 18:43:19,"Today, I signed an Executive Order on Improving Accountability and Whistleblower Protection at the @DeptVetAffairs:… https://t.co/UQ6VNCyhlj"
496,4/28/2017 12:12:15,4/28/2017 8:12:15,"RT @foxandfriends: Former President Obama's $400K Wall Street speech stuns liberal base; Sen. Warren saying she ""was troubled by that"" http…"
497,4/28/2017 12:15:59,4/28/2017 8:15:59,"We are making tremendous progress with the V. A. There has never been so much done so quickly, and we have just started. We love our VETS!"
498,4/28/2017 22:31:25,4/28/2017 18:31:25,I will be interviewed by @MarthaMaccallum on @FoxNews tonight at 7pm. Enjoy!
499,4/28/2017 23:26:18,4/28/2017 19:26:18,"North Korea disrespected the wishes of China &amp; its highly respected President when it launched, though unsuccessfully, a missile today. Bad!"